,_id,Name,Address,Geocodes
209,909,Forest Grove Elementary School,"485 Pine Ave, Pacific Grove, CA 93950, USA","{'lat': 36.6178258, 'lng': -121.916629}"
210,910,Placentia-Yorba Linda Unified School District,"5200 Vía De La Escuela, Yorba Linda, CA 92887, USA","{'lat': 33.8849998, 'lng': -117.7596021}"
211,911,The Pegasus School,"19692 Lexington Ln, Huntington Beach, CA 92646, USA","{'lat': 33.6771944, 'lng': -117.9472336}"
212,912,Calistoga Joint Unified School District,"2422 Debbie Way, Calistoga, CA 94515, USA","{'lat': 38.5845977, 'lng': -122.5931875}"
213,913,Delhi Elementary School District,"9716 Hinton Ave, Delhi, CA 95315, USA","{'lat': 37.4301379, 'lng': -120.7784763}"
214,914,Fallbrook Union High School,"321 Iowa St, Fallbrook, CA 92028, USA","{'lat': 33.3840266, 'lng': -117.2471042}"
215,915,Kings Canyon Adult School,"675 Manning Ave, Reedley, CA 93654, USA","{'lat': 36.6039362, 'lng': -119.4549752}"
216,916,Cutler-Orosi Joint Unified School District,"12623 Avenue 416, Orosi, CA 93647, USA","{'lat': 36.5445651, 'lng': -119.290841}"
217,917,St. Margaret's Episcopal School,"31641 La Novia Ave, San Juan Capistrano, CA 92675, USA","{'lat': 33.5045035, 'lng': -117.6505175}"
218,918,Maranatha High School,"169 S St John Ave, Pasadena, CA 91105, USA","{'lat': 34.1427997, 'lng': -118.1570373}"
219,919,San Jose Unified School District,"555 Dana Ave, San Jose, CA 95126, USA","{'lat': 37.327419, 'lng': -121.9247129}"
220,920,The Bay School of San Francisco,"35 Keyes Ave, San Francisco, CA 94129, USA","{'lat': 37.8007795, 'lng': -122.455646}"
221,921,San Carlos School,"450 Church St, Monterey, CA 93940, USA","{'lat': 36.595882, 'lng': -121.8911472}"
222,922,Tamalpais Union High School District,"375 Doherty Dr, Larkspur, CA 94939, USA","{'lat': 37.9376714, 'lng': -122.5267043}"
223,923,San Mateo Union High School District,"398 Primrose Rd, Burlingame, CA 94010, USA","{'lat': 37.5789932, 'lng': -122.3490337}"
224,924,Coalinga-Huron Joint Unified,"265 Cambridge Ave, Coalinga, CA 93210, USA","{'lat': 36.1506594, 'lng': -120.3614155}"
225,925,San Jose Unified School District,"1290 Blossom Hill Rd, San Jose, CA 95118, USA","{'lat': 37.2471368, 'lng': -121.8825887}"
226,926,Jefferson Elem School Dist,"7500 W Linne Rd, Tracy, CA 95304, USA","{'lat': 37.694892, 'lng': -121.3966843}"
227,927,Pomona Unified School District,"800 S Garey Ave, Pomona, CA 91766, USA","{'lat': 34.0519441, 'lng': -117.7493934}"
228,928,Monrovia High School,"325 E Huntington Dr, Monrovia, CA 91016, USA","{'lat': 34.140821, 'lng': -117.9956592}"
229,929,Yucaipa-Calimesa Jnt Sch Dist,"12797 3rd St, Yucaipa, CA 92399, USA","{'lat': 34.0214601, 'lng': -117.0470894}"
230,930,Paradise Unified School District,"6696 Clark Rd, Paradise, CA 95969, USA","{'lat': 39.7786437, 'lng': -121.5893072}"
231,931,Richland School District - CA,"331 Shafter Ave, Shafter, CA 93263, USA","{'lat': 35.5040835, 'lng': -119.2787908}"
232,932,Bright Minds Institute,"814 S Westgate Ave #100, Los Angeles, CA 90049, USA","{'lat': 34.0522778, 'lng': -118.4696806}"
233,933,MVLA High School Foundation,"1299 Bryant Ave, Mountain View, CA 94040, USA","{'lat': 37.3610221, 'lng': -122.0648352}"
234,934,Valle Lindo School District,"1431 Central Ave, South El Monte, CA 91733, USA","{'lat': 34.0437274, 'lng': -118.0482485}"
235,935,Carpinteria High School,"4698 Foothill Rd, Carpinteria, CA 93013, USA","{'lat': 34.41092769999999, 'lng': -119.5189276}"
236,936,Eastside College Preparatory School,"1041 Myrtle St, East Palo Alto, CA 94303, USA","{'lat': 37.4635839, 'lng': -122.1321567}"
237,937,Goleta Valley Junior High School,"6100 Stow Canyon Rd, Goleta, CA 93117, USA","{'lat': 34.4501166, 'lng': -119.8350738}"
238,938,Savanna High School,"301 N Gilbert St, Anaheim, CA 92801, USA","{'lat': 33.8349248, 'lng': -117.9689237}"
239,939,The Pajaro Valley Unified School District schools,"294 Green Valley Rd, Watsonville, CA 95076, USA","{'lat': 36.939318, 'lng': -121.7688838}"
240,940,The Pajaro Valley Unified School District schools,"294 Green Valley Rd, Watsonville, CA 95076, USA","{'lat': 36.939318, 'lng': -121.7688838}"
241,941,Sacramento High School,"3400 3rd Ave, Sacramento, CA 95817, USA","{'lat': 38.55167, 'lng': -121.4697113}"
242,942,Hollister School District,"2690 Cienega Rd, Hollister, CA 95023, USA","{'lat': 36.8234695, 'lng': -121.4014625}"
243,943,Thousand Oaks High School,"2323 N Moorpark Rd, Thousand Oaks, CA 91360, USA","{'lat': 34.2108402, 'lng': -118.869511}"
244,944,Monrovia High School,"The Myrtle Building, 525 S Myrtle Ave, Monrovia, CA 91016, USA","{'lat': 34.146104, 'lng': -118.0013166}"
245,945,Westerly School,"2950 E 29th St, Long Beach, CA 90806, USA","{'lat': 33.8073059, 'lng': -118.1559934}"
246,946,Villegas Ysmael Middle School,"4140 Tyler St, Riverside, CA 92503, USA","{'lat': 33.9175894, 'lng': -117.4663981}"
247,947,Villegas Ysmael Middle School,"6585 Crest Ave, Riverside, CA 92503, USA","{'lat': 33.9494254, 'lng': -117.4747252}"
248,948,Newport Harbor High School,"2985 Bear St, Costa Mesa, CA 92626, USA","{'lat': 33.6784932, 'lng': -117.8945076}"
249,949,Willows Unified School District,"823 W Laurel St, Willows, CA 95988, USA","{'lat': 39.51815879999999, 'lng': -122.2035344}"
250,950,Los Gatos Saratoga Joint Un,"17421 Farley Rd W, Los Gatos, CA 95030, USA","{'lat': 37.2404446, 'lng': -121.9748988}"
251,951,The Pajaro Valley Unified School District schools,"250 E Beach St, Watsonville, CA 95076, USA","{'lat': 36.9123474, 'lng': -121.752672}"
252,952,Cathedral School for Boys,"1275 Sacramento St, San Francisco, CA 94108, USA","{'lat': 37.7922206, 'lng': -122.4138333}"
253,953,Mission Hills Community Church,"29582 Aventura, Rancho Santa Margarita, CA 92688, USA","{'lat': 33.6343156, 'lng': -117.6142488}"
254,954,Santa Maria Joint Union High School District,"2560 Skyway Dr, Santa Maria, CA 93455, USA","{'lat': 34.9129024, 'lng': -120.4532256}"
255,955,Union School District,"5175 Union Ave, San Jose, CA 95124, USA","{'lat': 37.2440446, 'lng': -121.9317561}"
256,956,ANDERSON UNION HIGH,"1469 Ferry St, Anderson, CA 96007, USA","{'lat': 40.4443513, 'lng': -122.3053516}"
257,957,Los Altos School District,"201 Covington Rd, Los Altos, CA 94024, USA","{'lat': 37.3715414, 'lng': -122.1070739}"
258,958,Villegas Ysmael Middle School,"10365 Keller Ave, Riverside, CA 92505, USA","{'lat': 33.9338486, 'lng': -117.479726}"
259,959,Victor Elementary School District,"14711 Mojave Dr, Victorville, CA 92394, USA","{'lat': 34.5269184, 'lng': -117.3414712}"
260,960,Oakdale Joint Unified School District,"168 S 3rd Ave, Oakdale, CA 95361, USA","{'lat': 37.7652528, 'lng': -120.8474494}"
261,961,Crane School,"1795 San Leandro Ln, Santa Barbara, CA 93108, USA","{'lat': 34.42388380000001, 'lng': -119.620169}"
262,962,Monterey Adult School,"700 Pacific St, Monterey, CA 93940, USA","{'lat': 36.59540190000001, 'lng': -121.8986833}"
263,963,Bakersfield City School District,"1300 Baker St, Bakersfield, CA 93305, USA","{'lat': 35.3826075, 'lng': -118.9912504}"
264,964,Bay County Public School Academy,"1010 Wheatland Rd, Wheatland, CA 95692, USA","{'lat': 39.0067328, 'lng': -121.4305293}"
265,965,Willow Creek Academy,"33 Buchanan Dr, Sausalito, CA 94965, USA","{'lat': 37.863286, 'lng': -122.5029733}"
266,966,Simon Hodson,"903 Ashbury St, San Francisco, CA 94117, USA","{'lat': 37.7655609, 'lng': -122.4463036}"
267,967,Heschel Day School,"17701 Devonshire St, Northridge, CA 91325, USA","{'lat': 34.2587082, 'lng': -118.5204704}"
268,968,Waukegan Public Schools,"15 Goodyear, Irvine, CA 92618, USA","{'lat': 33.6505334, 'lng': -117.7103044}"
269,969,Oceanside Unified School District,"2070 Mission Ave, Oceanside, CA 92058, USA","{'lat': 33.2056008, 'lng': -117.3642641}"
270,970,Tamalpais Union High School District,"Larkspur, CA 94977, USA","{'lat': 37.94, 'lng': -122.51}"
271,971,Oxnard Union High Sch Dist,"3400 W Gonzales Rd, Oxnard, CA 93036, USA","{'lat': 34.2170371, 'lng': -119.2141885}"
272,972,Oxnard Union High Sch Dist,"545 Airport Way, Camarillo, CA 93010, USA","{'lat': 34.206644, 'lng': -119.0212576}"
273,973,Alhambra Unified School District,"100 S Granada Ave, Alhambra, CA 91801, USA","{'lat': 34.098341, 'lng': -118.1160975}"
274,974,Victor Elementary School District,"13962 Hook Blvd, Victorville, CA 92394, USA","{'lat': 34.5217185, 'lng': -117.3589391}"
275,975,Los Angeles Unified School District,"135 N Lake St, Los Angeles, CA 90026, USA","{'lat': 34.0681059, 'lng': -118.2710311}"
276,976,Valley Christian Schools,"100 Skyway Dr #117, San Jose, CA 95111, USA","{'lat': 37.2755122, 'lng': -121.8241126}"
277,977,Templeton Unified School District,"960 Old County Rd, Templeton, CA 93465, USA","{'lat': 35.5445889, 'lng': -120.7111041}"
278,978,San Mateo Union High School District,"650 N Delaware St, San Mateo, CA 94401, USA","{'lat': 37.5782769, 'lng': -122.3317874}"
279,979,Moorpark Unified School District,"14000 Peach Hill Rd, Moorpark, CA 93021, USA","{'lat': 34.2705461, 'lng': -118.865415}"
280,980,Bay School Of San Francisco,"35 Keyes Ave, San Francisco, CA 94129, USA","{'lat': 37.8007795, 'lng': -122.455646}"
281,981,Los Angeles Unified School District,"333 S Beaudry Ave, Los Angeles, CA 90017, USA","{'lat': 34.0561431, 'lng': -118.2573219}"
282,982,Irvine Unified School District,"51 Rockrose, Aliso Viejo, CA 92656, USA","{'lat': 33.5811868, 'lng': -117.7429038}"
283,983,Valley Achievement Center,"3200 Sillect Ave, Bakersfield, CA 93308, USA","{'lat': 35.3888887, 'lng': -119.0371862}"
284,984,Whittier Christian High School,"501 N Beach Blvd, La Habra, CA 90631, USA","{'lat': 33.9350954, 'lng': -117.9695643}"
285,985,Riverbank Unified School District,"6715 7th St, Riverbank, CA 95367, USA","{'lat': 37.73680969999999, 'lng': -120.9293636}"
286,986,Ravenswood City School District,"2120 Euclid Ave, East Palo Alto, CA 94303, USA","{'lat': 37.4636873, 'lng': -122.1434247}"
287,987,Heritage Intermediate School,"6061 East Ave, Etiwanda, CA 91739, USA","{'lat': 34.1439473, 'lng': -117.5140851}"
288,988,Richland School District - CA,"195 S Wall St, Shafter, CA 93263, USA","{'lat': 35.4988437, 'lng': -119.2808478}"
289,989,Dos Palos High School,"1701 E Blossom St, Dos Palos, CA 93620, USA","{'lat': 36.9857887, 'lng': -120.624439}"
290,990,Larkspur School District,"230 Doherty Dr, Larkspur, CA 94939, USA","{'lat': 37.9390132, 'lng': -122.531175}"
291,991,Oakland Aviation High School,"7801 Edgewater Dr, Oakland, CA 94621, USA","{'lat': 37.7415211, 'lng': -122.2036039}"
292,992,West Valley Christian Church,"22450 Sherman Way, West Hills, CA 91307, USA","{'lat': 34.2004621, 'lng': -118.6162032}"
293,993,Chowchilla ESD,"1101 Monterey Ave, Chowchilla, CA 93610, USA","{'lat': 37.1189878, 'lng': -120.2714867}"
294,994,Porterville Unified School District,"600 W Grand Ave, Porterville, CA 93257, USA","{'lat': 36.0774167, 'lng': -119.0311724}"
295,995,Grossmont Work Training Center,"1725 Hillsdale Rd, El Cajon, CA 92019, USA","{'lat': 32.7593355, 'lng': -116.9212147}"
296,996,Wiseburn School District,"13530 Aviation Blvd, Hawthorne, CA 90250, USA","{'lat': 33.9080069, 'lng': -118.3782662}"
297,997,Moreno Valley Unified School District,"13911 Perris Blvd, Moreno Valley, CA 92553, USA","{'lat': 33.9189302, 'lng': -117.2268934}"
298,998,Santa Maria Joint Union High School District,"2560 Skyway Dr, Santa Maria, CA 93455, USA","{'lat': 34.9129024, 'lng': -120.4532256}"
299,999,Los Angeles Unified School District,"13000 Montague St, Arleta, CA 91331, USA","{'lat': 34.2444689, 'lng': -118.4153152}"
