,_id,Name,Address,Geocodes
0,700,Fremont Christian Schools,"4760 Thornton Ave, Fremont, CA 94536, USA","{'lat': 37.5503601, 'lng': -122.0185691}"
1,701,Cathedral Catholic High School,"2660 Calhoun St, San Diego, CA 92110, USA","{'lat': 32.754574, 'lng': -117.1964137}"
2,702,The Rock Academy,"2277 Rosecrans St, San Diego, CA 92106, USA","{'lat': 32.7356227, 'lng': -117.2188314}"
3,703,Alma Heights Christian Academy,"1295 Seville Dr, Pacifica, CA 94044, USA","{'lat': 37.5881888, 'lng': -122.4931141}"
4,704,Colton Middle School,"1050 E Olive St, Colton, CA 92324, USA","{'lat': 34.0783675, 'lng': -117.310791}"
5,705,St Matthews School,"100 S Barrington Pl, Los Angeles, CA 90049, USA","{'lat': 34.0667518, 'lng': -118.4696603}"
6,706,Albert Einstein Charter Academy,"3035 Ash St, San Diego, CA 92102, USA","{'lat': 32.7201247, 'lng': -117.1303256}"
7,707,Natomas Charter School,"4600 Blackrock Dr, Sacramento, CA 95835, USA","{'lat': 38.6575152, 'lng': -121.4938169}"
8,708,Lodi Unified School District,"831 W Lockeford St, Lodi, CA 95240, USA","{'lat': 38.1392123, 'lng': -121.2851673}"
9,709,Lodi Unified School District,"1315 Woodcreek Way, Stockton, CA 95209, USA","{'lat': 38.0352377, 'lng': -121.3284956}"
10,710,Vacaville Unified School District,"401 Nut Tree Rd #100, Vacaville, CA 95687, USA","{'lat': 38.3647958, 'lng': -121.953795}"
11,711,Forest Charter School,"224 Church St, Nevada City, CA 95959, USA","{'lat': 39.2634909, 'lng': -121.0177863}"
12,712,GreatSchools Inc,"301 Howard St, San Francisco, CA 94105, USA","{'lat': 37.7897, 'lng': -122.3942999}"
13,713,Providence Cristo Rey High School,"2105 S Bascom Ave #220, Campbell, CA 95008, USA","{'lat': 37.2853214, 'lng': -121.9321007}"
14,714,La Jolla Country Day School,"9490 Genesee Ave, La Jolla, CA 92037, USA","{'lat': 32.878605, 'lng': -117.2165956}"
15,715,Berkwood Hedge School,"1809 Bancroft Way, Berkeley, CA 94703, USA","{'lat': 37.8669789, 'lng': -122.2742945}"
16,716,Ivy Academia,"6051 De Soto Ave, Woodland Hills, CA 91367, USA","{'lat': 34.1809525, 'lng': -118.5911898}"
17,717,San Diego City Schools,"1775 Chatsworth Blvd, San Diego, CA 92106, USA","{'lat': 32.7322945, 'lng': -117.2327042}"
18,718,GreatSchools Inc,"965 Mission St #500, San Francisco, CA 94103, USA","{'lat': 37.7814391, 'lng': -122.4075701}"
19,719,La Jolla Country Day School,"9490 Genesee Ave, La Jolla, CA 92037, USA","{'lat': 32.878605, 'lng': -117.2165956}"
20,720,Wah Mei Pre-school,"1400 Judah St, San Francisco, CA 94122, USA","{'lat': 37.7618643, 'lng': -122.4774461}"
21,721,ST PATRICK SCHOOL,"10626 Erwin St, North Hollywood, CA 91606, USA","{'lat': 34.182893, 'lng': -118.3623112}"
22,722,GreatSchools Inc,"837 Turk St # 35, San Francisco, CA 94102, USA","{'lat': 37.781418, 'lng': -122.422961}"
23,723,Idyllwild Arts Academy,"52500 Temecula Rd, Idyllwild-Pine Cove, CA 92549, USA","{'lat': 33.7337283, 'lng': -116.7468366}"
24,724,St. Matthias High School,"7851 Gardendale St, Downey, CA 90242, USA","{'lat': 33.9193469, 'lng': -118.1594443}"
25,725,South Bay Union School District,"601 Elm Ave, Imperial Beach, CA 91932, USA","{'lat': 32.5800193, 'lng': -117.1201788}"
26,726,Our Lady-Assumption School,"611 W Bonita Ave, Claremont, CA 91711, USA","{'lat': 34.0967423, 'lng': -117.7242337}"
27,727,Sage Hill School,"20402 Newport Coast Dr, Newport Beach, CA 92657, USA","{'lat': 33.619052, 'lng': -117.823358}"
28,728,Los Altos School District,"201 Covington Rd, Los Altos, CA 94024, USA","{'lat': 37.3715414, 'lng': -122.1070739}"
29,729,Chester County Intermediate Unit,"839 4th St, Eureka, CA 95501, USA","{'lat': 40.8036137, 'lng': -124.1621438}"
30,730,FUSD,"4210 Technology Dr, Fremont, CA 94538, USA","{'lat': 37.5079221, 'lng': -121.9545989}"
31,731,Plumas Unified School District,"50 Church St, Quincy, CA 95971, USA","{'lat': 39.9361077, 'lng': -120.9438437}"
32,732,SNOWLINE JOINT UNIFIED,"4075 Nielson Rd, Phelan, CA 92371, USA","{'lat': 34.4184036, 'lng': -117.5731701}"
33,733,Del Mar Union School District,"225 9th St, Del Mar, CA 92014, USA","{'lat': 32.9529566, 'lng': -117.2632715}"
34,734,West Side Union School District,"1201 Felta Rd, Healdsburg, CA 95448, USA","{'lat': 38.5799296, 'lng': -122.8833105}"
35,735,Oceanside Unified School District,"2111 Mission Ave, Oceanside, CA 92054, USA","{'lat': 33.2062481, 'lng': -117.3618771}"
36,736,Bennett Valley Union School District,"2250 Mesquite Dr, Santa Rosa, CA 95405, USA","{'lat': 38.429427, 'lng': -122.6733487}"
37,737,Golden Valley High School,"27801 Dickason Dr, Valencia, CA 91355, USA","{'lat': 34.4404892, 'lng': -118.5628821}"
38,738,Acton-Agua Dulce Unified School District,"32248 Crown Valley Rd, Acton, CA 93510, USA","{'lat': 34.4729988, 'lng': -118.1967376}"
39,739,Golden Valley High School,"21515 Centre Pointe Pkwy, Santa Clarita, CA 91350, USA","{'lat': 34.4123479, 'lng': -118.5132047}"
40,740,ABC So-Cal,"1400 Kellogg Dr STE A, Anaheim, CA 92807, USA","{'lat': 33.8618847, 'lng': -117.8055892}"
41,741,Chester County Intermediate Unit,"825 5th St RM 125, Ferndale, CA 95536, USA","{'lat': 40.5874066, 'lng': -124.2660153}"
42,742,Mid-Peninsula High School,"1340 Willow Rd, Menlo Park, CA 94025, USA","{'lat': 37.476431, 'lng': -122.1520301}"
43,743,SEEK Education Inc,"9060 Huntington Dr, San Gabriel, CA 91775, USA","{'lat': 34.1300489, 'lng': -118.0710009}"
44,744,Plumas Unified School District,"50 Church St, Quincy, CA 95971, USA","{'lat': 39.9361077, 'lng': -120.9438437}"
45,745,Pomona Unified School District,"701 N Huntington Blvd, Pomona, CA 91768, USA","{'lat': 34.0648858, 'lng': -117.7617802}"
46,746,Madonna Del Sasso School,"20 Santa Teresa Way, Salinas, CA 93906, USA","{'lat': 36.6962743, 'lng': -121.6456256}"
47,747,Avenal Elementary School,"205 N Park Ave, Avenal, CA 93204, USA","{'lat': 36.0086024, 'lng': -120.1250336}"
48,748,Newport Harbor High School,"2900 Bristol St C106, Costa Mesa, CA 92626, USA","{'lat': 33.6759659, 'lng': -117.8864463}"
49,749,San Mateo - Foster City School District,"51 41st Ave, San Mateo, CA 94403, USA","{'lat': 37.5301625, 'lng': -122.2913726}"
50,750,CAPO BEACH CALVARY SCHOOL,"25975 Domingo Ave, Dana Point, CA 92624, USA","{'lat': 33.4653064, 'lng': -117.6763932}"
51,751,Hillcrest Christian School,"2030 Main St, Irvine, CA 92614, USA","{'lat': 33.6831757, 'lng': -117.8532131}"
52,752,Redwood City School District,"750 Bradford St, Redwood City, CA 94063, USA","{'lat': 37.488432, 'lng': -122.2273868}"
53,753,Martin County School District,"333 S Beaudry Ave, Los Angeles, CA 90017, USA","{'lat': 34.0561431, 'lng': -118.2573219}"
54,754,Hillcrest Christian School,"2030 Main St, Irvine, CA 92614, USA","{'lat': 33.6831757, 'lng': -117.8532131}"
55,755,Desert Sands Unified School District,"47950 Dune Palms Rd, La Quinta, CA 92253, USA","{'lat': 33.7010127, 'lng': -116.2773595}"
56,756,Alameda Community Learning Center,"1900 3rd St, Alameda, CA 94501, USA","{'lat': 37.778968, 'lng': -122.28747}"
57,757,Kern High School District,"5801 Sundale Ave, Bakersfield, CA 93309, USA","{'lat': 35.3424374, 'lng': -119.0651752}"
58,758,Palm Springs Teachers Association,"980 E Tahquitz Canyon Way, Palm Springs, CA 92262, USA","{'lat': 33.8240262, 'lng': -116.5374324}"
59,759,Alexander Valley School,"8511 CA-128, Healdsburg, CA 95448, USA","{'lat': 38.6550293, 'lng': -122.794013}"
60,760,Bakersfield City School District,"1300 Baker St, Bakersfield, CA 93305, USA","{'lat': 35.3826075, 'lng': -118.9912504}"
61,761,Dos Palos High School,"2041 Almond St, Dos Palos, CA 93620, USA","{'lat': 36.98471350000001, 'lng': -120.6287534}"
62,762,Los Angeles Unified School District,"333 S Beaudry Ave, Los Angeles, CA 90017, USA","{'lat': 34.0561431, 'lng': -118.2573219}"
63,763,Shasta Union High School District,"3411 Churn Creek Rd, Redding, CA 96002, USA","{'lat': 40.55839870000001, 'lng': -122.3514752}"
64,764,Irvine Unified School District,"5050 Barranca Pkwy, Irvine, CA 92604, USA","{'lat': 33.6756332, 'lng': -117.7922157}"
65,765,Pacific Ridge School,"6269 El Fuerte St, Carlsbad, CA 92009, USA","{'lat': 33.1231707, 'lng': -117.2496075}"
66,766,Laguna Beach Unified School District,"625 Park Ave, Laguna Beach, CA 92651, USA","{'lat': 33.5418633, 'lng': -117.7752912}"
67,767,Sacramento High School,"2315 34th St, Sacramento, CA 95817, USA","{'lat': 38.5573233, 'lng': -121.467176}"
68,768,Ekstrand Elementary School,"115 W Allen Ave, San Dimas, CA 91773, USA","{'lat': 34.11788689999999, 'lng': -117.8077816}"
69,769,San Marino Unified School District,"1665 West Dr, San Marino, CA 91108, USA","{'lat': 34.1181326, 'lng': -118.1122907}"
70,770,Marin County School District,"1111 Las Gallinas Ave, San Rafael, CA 94903, USA","{'lat': 38.0135122, 'lng': -122.5502666}"
71,771,Sierra View Elementary School,"North Fork, CA 93643, USA","{'lat': 37.2293678, 'lng': -119.5094012}"
72,772,Monrovia USD,"325 E Huntington Dr, Monrovia, CA 91016, USA","{'lat': 34.140821, 'lng': -117.9956592}"
73,773,The Bay School of San Francisco,"35 Keyes Ave, San Francisco, CA 94129, USA","{'lat': 37.8007795, 'lng': -122.455646}"
74,774,Newport Harbor High School,"2985 Bear St STE C, Costa Mesa, CA 92626, USA","{'lat': 33.6784932, 'lng': -117.8945076}"
75,775,Silver Valley Unified School District,"Yermo, CA, USA","{'lat': 34.9067778, 'lng': -116.838024}"
76,776,Garden Grove Unified School District,"10331 Stanford Ave, Garden Grove, CA 92840, USA","{'lat': 33.7782173, 'lng': -117.9524962}"
77,777,San Mateo-Foster City School District,"1170 Chess Dr, Foster City, CA 94404, USA","{'lat': 37.5660482, 'lng': -122.2736299}"
78,778,Diocese of Stockton,"1105 N Lincoln St, Stockton, CA 95203, USA","{'lat': 37.9623241, 'lng': -121.3009452}"
79,779,Alameda Unified School District,"2200 Central Ave, Alameda, CA 94501, USA","{'lat': 37.7649581, 'lng': -122.2459352}"
80,780,Greenfield Union Sch Dist,"493 El Camino Real, Greenfield, CA 93927, USA","{'lat': 36.3259507, 'lng': -121.2482844}"
81,781,Moorpark Unified School District,"5297 Maureen Ln, Moorpark, CA 93021, USA","{'lat': 34.2819286, 'lng': -118.8969971}"
82,782,Riverside County Office of Education,"569 Main St Ste A, El Centro, CA 92243, USA","{'lat': 32.792537, 'lng': -115.556393}"
83,783,Moreno Valley Unified School District,"25634 Alessandro Blvd, Moreno Valley, CA 92553, USA","{'lat': 33.9184088, 'lng': -117.2152448}"
84,784,Kern High School District,"5801 Sundale Ave, Bakersfield, CA 93309, USA","{'lat': 35.3424374, 'lng': -119.0651752}"
85,785,Mueller Charter School,"715 I St, Chula Vista, CA 91910, USA","{'lat': 32.626918, 'lng': -117.0932617}"
86,786,Hayward Unified School District,"Hayward, CA 94540, USA","{'lat': 37.6599999, 'lng': -122.1}"
87,787,Corning Union High School Dst,"18335 Johnson Rd, Red Bluff, CA 96080, USA","{'lat': 40.1561362, 'lng': -122.3553426}"
88,788,Murrieta Valley Unified School District,"24105 Washington Ave, Murrieta, CA 92562, USA","{'lat': 33.5652426, 'lng': -117.2272263}"
89,789,Sierra Canyon School,"11052 Independence Ave, Chatsworth, CA 91311, USA","{'lat': 34.27047160000001, 'lng': -118.5912872}"
90,790,Rialto Unified School District,"1900 W Randall Ave, Colton, CA 92324, USA","{'lat': 34.0850033, 'lng': -117.357248}"
91,791,Robinson Jr. High,"3005 Tasman Dr, Santa Clara, CA 95054, USA","{'lat': 37.4042375, 'lng': -121.9833012}"
92,792,Rio School District,"2500 E Vineyard Ave, Oxnard, CA 93036, USA","{'lat': 34.2327401, 'lng': -119.1720636}"
93,793,Pomona Unified School District,"800 S Garey Ave, Pomona, CA 91766, USA","{'lat': 34.0519441, 'lng': -117.7493934}"
94,794,Los Angeles Unified School District,"14041 Chase St, Van Nuys, CA 91402, USA","{'lat': 34.226489, 'lng': -118.439682}"
95,795,Richland School District - CA,"331 Shafter Ave, Shafter, CA 93263, USA","{'lat': 35.5040835, 'lng': -119.2787908}"
96,796,Kapolei Golf Course,"425 California St # 1000, San Francisco, CA 94104, USA","{'lat': 37.7927916, 'lng': -122.4014216}"
97,797,Marin County School District,"1111 Las Gallinas Ave, San Rafael, CA 94903, USA","{'lat': 38.0135122, 'lng': -122.5502666}"
98,798,Mountain View-Whisman School District,"750-A San Pierre Way, Mountain View, CA 94043, USA","{'lat': 37.4030873, 'lng': -122.0839384}"
99,799,Wheatland Elem Sch District,"711 Olive St, Wheatland, CA 95692, USA","{'lat': 39.01123949999999, 'lng': -121.4288774}"
100,800,Los Angeles Unified School District,"1400 Rolling Knoll Rd, Diamond Bar, CA 91765, USA","{'lat': 33.9961032, 'lng': -117.8073066}"
101,801,Los Altos School District,"1689 Columbia Dr, Mountain View, CA 94040, USA","{'lat': 37.374512, 'lng': -122.0948621}"
102,802,Los Angeles Unified School District,"3825 Bell Ave, Bell, CA 90201, USA","{'lat': 33.9757126, 'lng': -118.1976287}"
103,803,Oakdale Joint Unified School District,"151 N Lee Ave, Oakdale, CA 95361, USA","{'lat': 37.7642096, 'lng': -120.8645857}"
104,804,Los Angeles Unified School District,"8715 La Salle Ave, Los Angeles, CA 90047, USA","{'lat': 33.9581112, 'lng': -118.3060527}"
105,805,Magnolia School District,"1411 S Gilbert St, Anaheim, CA 92804, USA","{'lat': 33.8123072, 'lng': -117.9680322}"
106,806,Los Angeles Unified School District,"333 S Beaudry Ave, Los Angeles, CA 90017, USA","{'lat': 34.0561431, 'lng': -118.2573219}"
107,807,Rio School District,"600 Simon Way, Oxnard, CA 93036, USA","{'lat': 34.2392244, 'lng': -119.1590526}"
108,808,Alhambra Senior High,"614 F St, Martinez, CA 94553, USA","{'lat': 38.0004899, 'lng': -122.1308517}"
109,809,Newport Harbor High School,"900 Goldenrod Ave, Corona Del Mar, CA 92625, USA","{'lat': 33.60315569999999, 'lng': -117.8701761}"
110,810,The Calhoun School,"400 Reed St A, Santa Clara, CA 95050, USA","{'lat': 37.3605861, 'lng': -121.9393561}"
111,811,Oxnard Union High Sch Dist,"309 S K St, Oxnard, CA 93030, USA","{'lat': 34.2001393, 'lng': -119.1923909}"
112,812,Ekstrand Elementary School,"115 W Allen Ave, San Dimas, CA 91773, USA","{'lat': 34.11788689999999, 'lng': -117.8077816}"
113,813,Rio School District,"3150 Thames River Dr, Oxnard, CA 93036, USA","{'lat': 34.2436737, 'lng': -119.1665475}"
114,814,Fontana Joint No 8 School District,"9011 Oleander Ave, Fontana, CA 92335, USA","{'lat': 34.0900532, 'lng': -117.448224}"
115,815,Los Angeles Unified School District,"605 N Boyle Ave, Los Angeles, CA 90033, USA","{'lat': 34.0526478, 'lng': -118.216889}"
116,816,Los Angeles Unified School District,"1061 W Temple St, Los Angeles, CA 90012, USA","{'lat': 34.0630891, 'lng': -118.2505272}"
117,817,Kapolei Golf Course,"4040 Civic Center Dr, San Rafael, CA 94903, USA","{'lat': 38.0060053, 'lng': -122.5382458}"
118,818,Yosemite High School,"50200 High School Rd, Oakhurst, CA 93644, USA","{'lat': 37.328785, 'lng': -119.6314522}"
119,819,Santa Clara Cnty Education Ofc,"180 W Hedding St, San Jose, CA 95110, USA","{'lat': 37.351402, 'lng': -121.906069}"
120,820,Moreno Valley Unified School District,"25634 Alessandro Blvd, Moreno Valley, CA 92553, USA","{'lat': 33.9184088, 'lng': -117.2152448}"
121,821,Hueneme School District,"205 N Ventura Rd, Port Hueneme, CA 93041, USA","{'lat': 34.14948930000001, 'lng': -119.1958424}"
122,822,Bellevue Union Elementary School District,"3150 Education Dr, Santa Rosa, CA 95407, USA","{'lat': 38.3995827, 'lng': -122.7097108}"
123,823,Fairfld-Sisun Unified Schl Dst,"2490 Hilborn Rd, Fairfield, CA 94534, USA","{'lat': 38.2761952, 'lng': -122.0506197}"
124,824,Ukiah Unified School District,"925 N State St, Ukiah, CA 95482, USA","{'lat': 39.159827, 'lng': -123.208664}"
125,825,De Marillac Academy,"175 Golden Gate Ave, San Francisco, CA 94102, USA","{'lat': 37.7816135, 'lng': -122.413057}"
126,826,Wright Elementary School,"4389 Price Ave, Santa Rosa, CA 95407, USA","{'lat': 38.4195544, 'lng': -122.7738424}"
127,827,Santa Ynez Valley Charter School,"Santa Ynez, CA, USA","{'lat': 34.6144313, 'lng': -120.079868}"
128,828,Delano Union School District,"1405 12th Ave, Delano, CA 93215, USA","{'lat': 35.7743958, 'lng': -119.2388618}"
129,829,Alhambra Senior High,"1600 Court St, Martinez, CA 94553, USA","{'lat': 38.013457, 'lng': -122.1305596}"
130,830,San Mateo Union High School District,"650 N Delaware St, San Mateo, CA 94401, USA","{'lat': 37.5782769, 'lng': -122.3317874}"
131,831,Oxnard Union High Sch Dist,"309 S K St, Oxnard, CA 93030, USA","{'lat': 34.2001393, 'lng': -119.1923909}"
132,832,Los Banos Unified SD,"763 J St, Los Banos, CA 93635, USA","{'lat': 37.0585876, 'lng': -120.8459689}"
133,833,Fairmont Private School,"2200 W Sequoia Ave, Anaheim, CA 92801, USA","{'lat': 33.8436434, 'lng': -117.9600924}"
134,834,McFarland Unified School District,"601 2nd St, McFarland, CA 93250, USA","{'lat': 35.6805338, 'lng': -119.229672}"
135,835,Redwood City School District,"750 Bradford St, Redwood City, CA 94063, USA","{'lat': 37.488432, 'lng': -122.2273868}"
136,836,Woodland Joint Unified School District,"630 Cottonwood St, Woodland, CA 95695, USA","{'lat': 38.6728446, 'lng': -121.7945998}"
137,837,Pacifica School District,"830 Rosita Rd, Pacifica, CA 94044, USA","{'lat': 37.5857679, 'lng': -122.4990386}"
138,838,The Pajaro Valley Unified School District schools,"294 Green Valley Rd, Watsonville, CA 95076, USA","{'lat': 36.939318, 'lng': -121.7688838}"
139,839,Lake Tahoe Unified School District,"1021 Al Tahoe Blvd, South Lake Tahoe, CA 96150, USA","{'lat': 38.9347674, 'lng': -119.9770118}"
140,840,Solvang School District,"565 Atterdag Rd, Solvang, CA 93463, USA","{'lat': 34.5978824, 'lng': -120.14206}"
141,841,Central School District,"Rancho Cucamonga, CA 91730, USA","{'lat': 34.0965313, 'lng': -117.5848025}"
142,842,Charter Oak Unified School District,"District Service Center, 20240 E Cienega Ave, Covina, CA 91724, USA","{'lat': 34.102653, 'lng': -117.8582953}"
143,843,Irvine Unified School District,"4321 Walnut Ave, Irvine, CA 92604, USA","{'lat': 33.7025593, 'lng': -117.782529}"
144,844,Community Gatepath,"875 Stanton Rd, Burlingame, CA 94010, USA","{'lat': 37.5982076, 'lng': -122.3708365}"
145,845,SNOWLINE JOINT UNIFIED,"9298 Sheep Creek Rd, Phelan, CA 92371, USA","{'lat': 34.4178489, 'lng': -117.5734307}"
146,846,Murrieta Valley Unified School District,"24725 Adams Ave, Murrieta, CA 92562, USA","{'lat': 33.557138, 'lng': -117.2132729}"
147,847,Garden Grove Unified School District,"10331 Stanford Ave, Garden Grove, CA 92840, USA","{'lat': 33.7782173, 'lng': -117.9524962}"
148,848,Bakersfield City School District,"2710 Niles St, Bakersfield, CA 93306, USA","{'lat': 35.3769885, 'lng': -118.9568673}"
149,849,Union School District,"5175 Union Ave, San Jose, CA 95124, USA","{'lat': 37.2440446, 'lng': -121.9317561}"
150,850,Anaheim Union High School District,"501 N Crescent Way, Anaheim, CA 92801, USA","{'lat': 33.8377201, 'lng': -117.948698}"
151,851,Garden Grove Unified School District,"10331 Stanford Ave, Garden Grove, CA 92840, USA","{'lat': 33.7781785, 'lng': -117.952178}"
152,852,Valley Achievement Center,"1400 Stine Rd, Bakersfield, CA 93309, USA","{'lat': 35.3416849, 'lng': -119.049095}"
153,853,MVLA High School Foundation,"1299 Bryant Ave, Mountain View, CA 94040, USA","{'lat': 37.3610221, 'lng': -122.0648352}"
154,854,San Jose Unified School District,"855 Lenzen Ave, San Jose, CA 95126, USA","{'lat': 37.3361154, 'lng': -121.9112646}"
155,855,Hueneme School District,"205 N Ventura Rd, Port Hueneme, CA 93041, USA","{'lat': 34.14948930000001, 'lng': -119.1958424}"
156,856,Newport Harbor High School,"2985 Bear St Ste A, Costa Mesa, CA 92626, USA","{'lat': 33.6784932, 'lng': -117.8945076}"
157,857,Solano County Office of Education,"5100 Business Center Dr, Fairfield, CA 94534, USA","{'lat': 38.2171327, 'lng': -122.1441572}"
158,858,Glendale Unified School District,"223 N Jackson St, Glendale, CA 91206, USA","{'lat': 34.1492171, 'lng': -118.2503812}"
159,859,Forest Grove Elementary School,"555 Sinex Ave, Pacific Grove, CA 93950, USA","{'lat': 36.6146722, 'lng': -121.9194868}"
160,860,Limerick Avenue Elementary School,"8530 Limerick Ave, Canoga Park, CA 91306, USA","{'lat': 34.225518, 'lng': -118.582101}"
161,861,Buena Terra Elementary School,"8299 Holder St, Buena Park, CA 90620, USA","{'lat': 33.8436582, 'lng': -118.019272}"
162,862,Crescent Intermediate SCHOOL,"5001 E Gerda Dr, Anaheim, CA 92807, USA","{'lat': 33.8510378, 'lng': -117.8080165}"
163,863,Mill Valley School District,"411 Sycamore Ave, Mill Valley, CA 94941, USA","{'lat': 37.8973313, 'lng': -122.5290071}"
164,864,FUSD,"4210 Technology Dr #652, Fremont, CA 94538, USA","{'lat': 37.5079221, 'lng': -121.9545989}"
165,865,OUSD,"2111 Mission Ave, Oceanside, CA 92054, USA","{'lat': 33.2062481, 'lng': -117.3618771}"
166,866,French American International School,"150 Oak St, San Francisco, CA 94102, USA","{'lat': 37.7754064, 'lng': -122.4223485}"
167,867,San Mateo Union High Schl Dst,"650 N Delaware St, San Mateo, CA 94401, USA","{'lat': 37.5782769, 'lng': -122.3317874}"
168,868,Cupertino Union School District,"10301 Vista Dr, Cupertino, CA 95014, USA","{'lat': 37.3271434, 'lng': -122.0282058}"
169,869,San Mateo Union High School District,"650 N Delaware St, San Mateo, CA 94401, USA","{'lat': 37.5782769, 'lng': -122.3317874}"
170,870,Palm Springs Teachers Association,"980 E Tahquitz Canyon Way, Palm Springs, CA 92262, USA","{'lat': 33.8240262, 'lng': -116.5374324}"
171,871,Los Angeles Unified School District,"5014 Serrania Ave, Woodland Hills, CA 91364, USA","{'lat': 34.160522, 'lng': -118.587346}"
172,872,Diocese of Stockton,"1105 N Lincoln St, Stockton, CA 95203, USA","{'lat': 37.9623241, 'lng': -121.3009452}"
173,873,Valley Arts & Science Academy,"770 N San Pablo Ave, Fresno, CA 93728, USA","{'lat': 36.75290400000001, 'lng': -119.7943521}"
174,874,Fallbrook Union High School,"1835 Gum Tree Ln, Fallbrook, CA 92028, USA","{'lat': 33.3870209, 'lng': -117.2247573}"
175,875,The San Francisco School,"300 Gaven St, San Francisco, CA 94134, USA","{'lat': 37.7327965, 'lng': -122.4117295}"
176,876,Alpine C.O.E.,"43 Hawkside Dr, Markleeville, CA 96120, USA","{'lat': 38.7663545, 'lng': -119.8088462}"
177,877,The Pajaro Valley Unified School District schools,"250 Aptos School Rd, Aptos, CA 95003, USA","{'lat': 36.976446, 'lng': -121.893721}"
178,878,Lynwood USD,"11321 Bullis Rd, Lynwood, CA 90262, USA","{'lat': 33.92619450000001, 'lng': -118.2005304}"
179,879,Capistrano Valley Christian School,"32032 Del Obispo St, San Juan Capistrano, CA 92675, USA","{'lat': 33.4981779, 'lng': -117.6715123}"
180,880,Pasadena Unified School District,"351 S Hudson Ave, Pasadena, CA 91101, USA","{'lat': 34.1396299, 'lng': -118.1341206}"
181,881,Los Angeles Unified School District,"1061 W Temple St, Los Angeles, CA 90012, USA","{'lat': 34.0630891, 'lng': -118.2505272}"
182,882,Mill Valley School District,"411 Sycamore Ave, Mill Valley, CA 94941, USA","{'lat': 37.8973313, 'lng': -122.5290071}"
183,883,Alhambra Unified School District,"1515 W Mission Rd, Alhambra, CA 91803, USA","{'lat': 34.0826915, 'lng': -118.1403676}"
184,884,East Bay Conservation Corps,"1021 3rd St, Oakland, CA 94607, USA","{'lat': 37.7999874, 'lng': -122.28642}"
185,885,Calistoga Joint Unified School District,"1520 Lake St, Calistoga, CA 94515, USA","{'lat': 38.5832101, 'lng': -122.5814816}"
186,886,Bay School Of San Francisco,"35 Keyes Ave, San Francisco, CA 94129, USA","{'lat': 37.8007795, 'lng': -122.455646}"
187,887,Cambrian School District,"161 W Williams St, Banning, CA 92220, USA","{'lat': 33.9275115, 'lng': -116.878335}"
188,888,Hayward Unified School District,"Hayward, CA 94540, USA","{'lat': 37.6599999, 'lng': -122.1}"
189,889,Sacred Heart Preparatory,"150 Valparaiso Ave, Atherton, CA 94027, USA","{'lat': 37.4491878, 'lng': -122.1964641}"
190,890,Marysville Joint Unified School District,"1919 B St, Marysville, CA 95901, USA","{'lat': 39.1576678, 'lng': -121.5873009}"
191,891,Lynwood USD,"11321 Bullis Rd, Lynwood, CA 90262, USA","{'lat': 33.92619450000001, 'lng': -118.2005304}"
192,892,Lafayette School District,"161 W Williams St, Banning, CA 92220, USA","{'lat': 33.9275115, 'lng': -116.878335}"
193,893,San Jose Unified School District,"6677 Camden Ave, San Jose, CA 95120, USA","{'lat': 37.2168268, 'lng': -121.8439849}"
194,894,San Jose Unified School District,"6384 Leyland Park Dr, San Jose, CA 95120, USA","{'lat': 37.219691, 'lng': -121.8789416}"
195,895,Los Angeles Unified School District,"333 S Beaudry Ave, Los Angeles, CA 90017, USA","{'lat': 34.0561431, 'lng': -118.2573219}"
196,896,San Jose Unified School District,"275 N 24th St, San Jose, CA 95116, USA","{'lat': 37.3504875, 'lng': -121.8716355}"
197,897,Mid-Peninsula High School,"1340 Willow Rd, Menlo Park, CA 94025, USA","{'lat': 37.476431, 'lng': -122.1520301}"
198,898,Romoland School District,"25900 Leon Rd, Homeland, CA 92548, USA","{'lat': 33.74479710000001, 'lng': -117.1181872}"
199,899,The Mt. Diablo Unified School,"1936 Carlotta Dr, Concord, CA 94519, USA","{'lat': 37.9865071, 'lng': -122.0054227}"
200,900,Campbell Union School District,"155 N 3rd St, Campbell, CA 95008, USA","{'lat': 37.2888855, 'lng': -121.9477895}"
201,901,Pacifica School District,"375 Reina Del Mar Ave, Pacifica, CA 94044, USA","{'lat': 37.6138961, 'lng': -122.4847795}"
202,902,North Monterey County Unified School District,"8142 Moss Landing Rd, Moss Landing, CA 95039, USA","{'lat': 36.7965721, 'lng': -121.7864327}"
203,903,Magnolia School District,"2705 W Orange Ave, Anaheim, CA 92804, USA","{'lat': 33.8252192, 'lng': -117.9801338}"
204,904,Bradshaw Christian School,"8324 Bradshaw Rd, Sacramento, CA 95829, USA","{'lat': 38.4558284, 'lng': -121.3353095}"
205,905,Larkspur School District,"230 Doherty Dr, Larkspur, CA 94939, USA","{'lat': 37.9390132, 'lng': -122.531175}"
206,906,Fullerton Elem School District,"1401 W Valencia Dr, Fullerton, CA 92833, USA","{'lat': 33.8669293, 'lng': -117.9511866}"
207,907,Beardsley School District,"900 Sanford Dr, Bakersfield, CA 93308, USA","{'lat': 35.4154295, 'lng': -119.0424469}"
208,908,Los Angeles Unified School District,"333 S Beaudry Ave #18, Los Angeles, CA 90017, USA","{'lat': 34.0561431, 'lng': -118.2573218}"
